{
  "$schema": "https://json-schema.org/draft/2020-12/schema",
  "$id": "https://ribon.dev/schema/product-v1.json",
  "title": "Ribon product composition v1",
  "type": "object",
  "required": [
    "schema_version",
    "product_id",
    "product_kind",
    "target_id",
    "architecture",
    "platform",
    "mode",
    "boot_protocols",
    "policies",
    "image",
    "evidence",
    "max_plugins",
    "services",
    "service_selections",
    "plugin_selections",
    "required_capabilities",
    "allowed_capabilities",
    "limits",
    "plugins"
  ],
  "properties": {
    "schema_version": {"const": 1},
    "product_id": {"type": "string", "minLength": 1},
    "product_kind": {"enum": ["library", "bootloader", "firmware"]},
    "target_id": {"type": "string", "minLength": 1},
    "architecture": {"enum": ["selected", "x86_64", "aarch64", "riscv64"]},
    "environment": {"type": "string", "minLength": 1},
    "firmware_personality": {"type": "string", "minLength": 1},
    "platform": {"type": "string", "minLength": 1},
    "mode": {"enum": ["normal", "recovery", "provisioning", "diagnostic"]},
    "boot_protocols": {"type": "array", "items": {"type": "string"}},
    "policies": {"type": "array", "minItems": 1, "items": {"type": "string"}},
    "image": {"$ref": "image-v1.json"},
    "evidence": {"type": "object"},
    "max_plugins": {"type": "integer", "minimum": 1, "maximum": 64},
    "services": {
      "type": "array",
      "items": {
        "type": "object",
        "required": ["id", "kind", "symbol"],
        "properties": {
          "id": {"type": "string", "minLength": 1},
          "kind": {"type": "string", "minLength": 1},
          "symbol": {"type": "string", "minLength": 1}
        }
      }
    },
    "service_selections": {
      "type": "array",
      "items": {
        "type": "object",
        "required": ["id", "kind"],
        "properties": {
          "id": {"type": "string", "minLength": 1},
          "kind": {"type": "string", "minLength": 1}
        }
      }
    },
    "plugin_selections": {
      "type": "array",
      "items": {
        "type": "object",
        "required": ["id", "kind"],
        "properties": {
          "id": {"type": "string", "minLength": 1},
          "kind": {"type": "string", "minLength": 1}
        }
      }
    },
    "required_capabilities": {"type": "array", "items": {"type": "string"}},
    "allowed_capabilities": {"type": "array", "items": {"type": "string"}},
    "limits": {"type": "object"},
    "plugins": {"type": "array", "minItems": 1, "items": {"type": "object"}}
  }
}
