{
  "schema_version": 1,
  "product_id": "bootmgr.x86_64-uefi-parus",
  "product_kind": "bootloader",
  "target_id": "x86_64-uefi-app",
  "architecture": "x86_64",
  "environment": "uefi",
  "platform": "pc-uefi-x86_64",
  "mode": "normal",
  "boot_protocols": [
    "parus"
  ],
  "policies": [
    "normal"
  ],
  "image": {
    "format": "pe-coff",
    "recipe": "uefi-application",
    "artifact": "BOOTX64.EFI"
  },
  "evidence": {
    "class": "qemu-smoke",
    "claim": "x86_64 UEFI application consumer boot"
  },
  "max_plugins": 16,
  "services": [
    {
      "id": "service.uefi-app.boot-source",
      "kind": "boot-source",
      "symbol": "ribon_uefi_app_boot_source_service_descriptor"
    },
    {
      "id": "service.uefi-app.monotonic-timer",
      "kind": "monotonic-timer",
      "symbol": "ribon_uefi_app_monotonic_timer_service_descriptor"
    }
  ],
  "service_selections": [],
  "plugin_selections": [],
  "required_capabilities": [
    "ARCHITECTURE",
    "BOOT_CONFIRMATION",
    "BOOT_PROTOCOL",
    "BOOT_SOURCE_READ",
    "ENTRY_CONTRACT",
    "HANDOFF",
    "IMAGE_ELF64",
    "MONOTONIC_TIMER",
    "PLATFORM_FACTS"
  ],
  "allowed_capabilities": [
    "ARCHITECTURE",
    "BOOT_CONFIRMATION",
    "BOOT_PROTOCOL",
    "BOOT_SOURCE_READ",
    "ENTRY_CONTRACT",
    "HANDOFF",
    "IMAGE_ELF64",
    "MONOTONIC_TIMER",
    "PLATFORM_FACTS"
  ],
  "limits": {
    "max_memory_regions": 256,
    "max_load_segments": 32,
    "max_components": 32,
    "max_retries": 2,
    "max_input_bytes": 67108864,
    "max_handoff_bytes": 65536,
    "arena_bytes": 262144,
    "operation_deadline_ms": 30000
  },
  "plugins": [
    {
      "id": "arch.x86_64",
      "package": "ribon.arch.x86_64",
      "symbol": "ribon_arch_plugin_descriptor"
    },
    {
      "id": "environment.uefi-app",
      "package": "ribon.environment.uefi-app",
      "symbol": "ribon_uefi_app_environment_plugin_descriptor"
    },
    {
      "id": "image.elf64",
      "package": "ribon.image.elf64",
      "symbol": "ribon_elf64_image_plugin_descriptor"
    },
    {
      "id": "platform.pc-uefi-x86_64",
      "package": "ribon.platform.pc-uefi-x86_64",
      "symbol": "ribon_platform_plugin_descriptor"
    },
    {
      "id": "protocol.parus",
      "package": "ribon.protocol.parus",
      "symbol": "ribon_parus_protocol_plugin_descriptor"
    }
  ]
}
